data_no,event_date,year,event_type,sub_event_type,actor1,country,admin1,admin2,location,latitude,longitude,source,notes,fatalities,timestamp
7562,7-Nov-20,2020,Protests,Peaceful protest,Protesters (United States),United States,Illinois,Cook,Chicago,41.85,-87.6501,Block Club Chicago; CBS2 (Chicago),"On 7 November 2020, huge crowds of Biden-Harris supporters gathered in downtown Chicago (Illinois) to celebrate The Associated Press projecting that former Vice President Joe Biden will become the 46th President of the United States. [size=huge crowds]",0,1612546507
7593,7-Nov-20,2020,Protests,Peaceful protest,Protesters (United States),United States,Illinois,Cook,Evanston,42.0411,-87.6901,CBS2 (Chicago),"On 7 November 2020, pro-Biden supporters gathered in downtown Evanston (Illinois) to celebrate The Associated Press projecting that former Vice President Joe Biden will become the 46th President of the United States. [size=no report]",0,1612546507
7895,5-Nov-20,2020,Protests,Peaceful protest,Protesters (United States),United States,Illinois,Cook,Chicago,41.85,-87.6501,Block Club Chicago,"On 5 November 2020, parents and community organizers gathered outside Sumner Elementary School in the neighborhood of North Lawndale In Chicago (Illinois) to push back against a proposal to consolidate three underutilized neighborhood schools in favor of a new, high-tech public school. [size=no report]",0,1612546507
7965,4-Nov-20,2020,Protests,Peaceful protest,Protesters (United States),United States,Illinois,Cook,Chicago,41.85,-87.6501,Chicago Sun-Times,"On 4 November 2020, at least 1,000 demonstrators including members from labor unions and progressive groups including SEIU gathered in Chicago (Illinois) to demand that every vote be counted and against Donald Trump's attempts to halt vote counting in other states. [size=at least 1,000] [count every vote]",0,1612546507
8221,2-Nov-20,2020,Protests,Peaceful protest,Protesters (United States),United States,Illinois,Cook,Chicago,41.85,-87.6501,Chicago Sun-Times,"On 2 November 2020, about a dozen people with Enlace Chicago and the Illinois Coalition for Immigration and Refugee Rights marched and carried yard signs and multilingual door-hangers in the Little Village neighborhood of Chicago (Illinois) encouraging people to vote and in support of the graduate income tax amendment. [size=about a dozen]",0,1612546507
8222,2-Nov-20,2020,Protests,Peaceful protest,Protesters (United States),United States,Illinois,Cook,Chicago,41.85,-87.6501,Chicago Sun-Times,"On 2 November 2020, a collective of Black business owners gathered on a commercial strip in the Chatham neighborhood of Chicago (Illinois) in support of voting and to urge people to cast ballots on Election Day. [size=a collective]",0,1612546507
8308,2-Nov-20,2020,Protests,Peaceful protest,Protesters (United States),United States,Illinois,Cook,Chicago,41.85,-87.6501,Chicago Tribune,"On 2 November 2020, some labor groups, including SEIU stood outside the Thompson Center in Chicago (Illinois) to declare the measures they were willing to take to ensure every vote is counted and any transfer of power is peaceful. [size=some]",0,1612546507
8355,1-Nov-20,2020,Protests,Peaceful protest,Protesters (United States),United States,Illinois,Cook,Chicago,41.85,-87.6501,Times of Northwest Indiana,"On 1 November 2020, people participated in a 'Stop the Violence' rally in Chicago (Illinois) in recognition of Timiya Andrews, an 8-year-old struck by gunfire and killed on Oct. 28th 2020. [size=no report]",0,1612546506
8366,1-Nov-20,2020,Protests,Peaceful protest,Protesters (United States),United States,Illinois,Cook,Evanston,42.0411,-87.6901,Fox News,"On 1 November 2020, students and Northwestern Community Not Cops organizers held a protest in Evanston (Illinois) in support of divesting from the police and against the presence of campus police officers. [size=no report]",0,1612546506
8460,31-Oct-20,2020,Protests,Peaceful protest,Protesters (United States),United States,Illinois,Cook,Chicago,41.85,-87.6501,Crowd Counting Consortium; Chicago Maroon,"On 31 October 2020, several groups including, Good Kids Mad City, #CareNotCops, Students Working Against Prisons and UC United staged demonstrations in Chicago (Illinois) in support of defunding the University of Chicago Police Department. Some students burned a banner with the UChicago crest on it, threw toilet paper on bushes, and spray painted some parts of campus. [size=several]",0,1612546507
8507,31-Oct-20,2020,Riots,Violent demonstration,Rioters (United States),United States,Illinois,Cook,Evanston,42.0411,-87.6901,Herald & Review; Fox32; CBS News,"On 31 October 2020, 150 students, graduate workers, teachers and organizers from the Northwestern Community Not Cops movement marched in Evanston (Illinois) demanding that the school cut ties with the campus police department. The demonstration turned violent when they broke windows, spray-painted graffiti, and threw rocks and bricks at officers. Police intervened, used pepper spray and a round of pepper balls on rioters. One student was arrested. [size=150]",0,1612546506
8544,30-Oct-20,2020,Protests,Peaceful protest,Protesters (United States),United States,Illinois,Cook,Evanston,42.0411,-87.6901,Daily Northwestern; Crowd Counting Consortium,"On 30 October 2020, about 200 Northwestern students, faculty and staff along with NU Community Not Cops joined together to march in Evanston (Illinois) to protest University Police, to encourage divesting from law enforcement and hear from abolitionist speakers. [size=about 200]",0,1612546506
8628,29-Oct-20,2020,Protests,Peaceful protest,Protesters (United States),United States,Illinois,Cook,Chicago,41.85,-87.6501,CBS58; Fox32,"On 29 October 2020, people gathered in Grant Park in Chicago (Illinois) in support of the Black Lives Matter movement and to encourage all of those who marched and protested this year to go out and vote to make their voices heard. [size=no report]",0,1612546506
8684,28-Oct-20,2020,Protests,Peaceful protest,Protesters (United States),United States,Illinois,Cook,Evanston,42.0411,-87.6901,Crowd Counting Consortium; Daily Northwestern,"On 28 October 2020, about 50 people gathered for the 17th consecutive day of action led by NUCNC (Northwestern University Community Not Cops) in Evanston (Illinois) demanding the abolition of University Police and in honor of Walter Wallace Jr., a 27-year-old Black man who was fatally shot by Philadelphia police Oct. 26th 2020. [size=about 50]",0,1612546507
8699,28-Oct-20,2020,Protests,Peaceful protest,Protesters (United States),United States,Illinois,Cook,Chicago,41.85,-87.6501,ABC7 Chicago,"On 28 October 2020, dozens of parents marched outside Mount Greenwood Elementary School in Chicago (Illinois) in support for in-school teaching and for a return to school during the ongoing coronavirus pandemic. [size=dozens]",0,1612546506
8884,26-Oct-20,2020,Protests,Peaceful protest,Protesters (United States),United States,Illinois,Cook,Chicago,41.85,-87.6501,WGN Channel 9,"On 26 October 2020, the families of George Floyd, Breonna Taylor, Jacob Blake and Marcellis Stinnette gathered in Grant Park in Chicago (Illinois) in support of the Black Lives Matter movement and in an effort to encourage all of those who marched and protested this year to vote for the policies they want to see. [size=no report]",0,1612546506
8930,25-Oct-20,2020,Protests,Peaceful protest,Protesters (United States),United States,Illinois,Cook,Chicago,41.85,-87.6501,Columbia Chronicle; Crowd Counting Consortium,"On 25 October 2020, around 100 supporters of Donald Trump dressed in ''Make America Great Again'' clothes gathered in the Oak Lawn suburb of Chicago (Illinois) to show support for the president before the election. A group of five counter protesters stood across the street waving flags for Joe Biden. [size=around 100] [counter-protest]",0,1612546507
9007,25-Oct-20,2020,Riots,Mob violence,Rioters (United States),United States,Illinois,Cook,Chicago,41.85,-87.6501,CBS News; Chicago Sun-Times,"On 25 October 2020, two women allegedly stabbed a security guard 27 times at a store in Chicago (Illinois) after he asked the two women to leave the store for refusing to wear masks due to the ongoing coronavirus pandemic while shopping. The two women were arrested, and the security guard was taken to a hospital for his injuries. [size=2]",0,1612546506
9074,24-Oct-20,2020,Protests,Protest with intervention,Protesters (United States),United States,Illinois,Cook,Evanston,42.0411,-87.6901,Daily Northwestern; Crowd Counting Consortium,"On 24 October 2020, students led by Northwestern Community Not Cops demonstrated along the perimeter of Ryan Field during the Maryland vs. Northwestern game in Evanston (Illinois) in support of Black Lives Matter movement and against the University Police, the killing of Marcellis Stinnette and Marc Nevarez. Police intervened in attempts to keep the students off the field and out of the game, but made no arrests. Some of the demonstrators alleged that the police hit their legs with their bicycles. [size=no report]",0,1612546506
9117,24-Oct-20,2020,Protests,Peaceful protest,Protesters (United States),United States,Illinois,Cook,Chicago,41.85,-87.6501,WGN Channel 9,"On 24 October 2020, nurses and home health workers gathered for a rally in Chicago (Illinois) to encourage voting and to honor their colleagues who have died due to coronavirus. [size=no report]",0,1612546505
9223,23-Oct-20,2020,Protests,Peaceful protest,Protesters (United States),United States,Illinois,Cook,Evanston,42.0411,-87.6901,Crowd Counting Consortium; Daily Northwestern,"On 23 October 2020, members of NU Community Not Cops and Fossil Free NU gathered to host ''A People's History of Northwestern'' in Evanston (Illinois) to mark the group's 12th consecutive day of action, to recognize past and present student activists at the University, and against the killing of Marcellis Stinnette. [size=no report]",0,1612546506
9293,22-Oct-20,2020,Protests,Peaceful protest,Protesters (United States),United States,Illinois,Cook,Evanston,42.0411,-87.6901,Daily Northwestern; Crowd Counting Consortium,"On 22 October 2020, about 75 students marched and staged a sit-in in Evanston (Illinois) to demand the school cut ties with the campus police department and reinvest the money workers. [size=about 75]",0,1612546505
9528,20-Oct-20,2020,Protests,Peaceful protest,Protesters (United States),United States,Illinois,Cook,Chicago,41.85,-87.6501,Fox32; Chicago Sun-Times; Chicago Tribune,"On 20 October 2020, crowds gathered for a 'Justice for Laquan' rally at Federal Plaza in Chicago (Illinois) in support of the Black Lives Matter movement and against police brutality and to demand justice for Laquan McDonald, a 17 year old who was killed 6 years ago by former police officer Jason Van Dyke. Dyke is currently serving time, but is expected to be released next year. Protesters say the sentence is not long enough. [size=crowds]",0,1612546505
9588,19-Oct-20,2020,Protests,Peaceful protest,Protesters (United States),United States,Illinois,Cook,Evanston,42.0411,-87.6901,Chicago Tribune,"On 19 October 2020, 300-400 students from Northwestern University gathered in front of the house of President Morton Schapiro in Evanston (Illinois) in support of the Black Lives Matter movement and against police brutality and against police involvement at NU. [size=300-400]",0,1612546505
9754,17-Oct-20,2020,Riots,Violent demonstration,Rioters (United States),United States,Illinois,Cook,Evanston,42.0411,-87.6901,Chicago Tribune,"On 17 October 2020, 300 students of Northwestern University and led by Northwestern University Community Not Cops, gathered in front of Foster-Walker Complex before marching to the house of the University President in Evanston (Illinois) demanding that the school cut ties with the campus police department. Some from the group also spray-painted local businesses, smashed a grocery store window and placed a burned school banner outside of the university president's home. [size=300]",0,1612546505
9809,17-Oct-20,2020,Protests,Peaceful protest,Protesters (United States),United States,Illinois,Cook,Chicago,41.85,-87.6501,Chicago Sun-Times; Fox32,"On 17 October 2020, hundreds of women demonstrated in Chicago (Illinois) as part of a nationwide 'Women's March' in opposition to President Donald Trump and his policies, particularly his nomination of Amy Coney Barrett to the U.S. Supreme Court. [size=hundreds]",0,1612546504
9811,17-Oct-20,2020,Protests,Peaceful protest,Protesters (United States),United States,Illinois,Cook,Chicago,41.85,-87.6501,WGN Channel 9,"On 17 October 2020, youth marched in the Englewood neighborhood of Chicago (Illinois) to highlight economic disparity in Chicago. [size=no report]",0,1612546504
10077,14-Oct-20,2020,Protests,Peaceful protest,Protesters (United States),United States,Illinois,Cook,Evanston,42.0411,-87.6901,Chicago Tribune,"Around 14 October 2020 (week of), about 200 students from Northwestern University gathered in the streets of Evanston (Illinois) in support of the Black Lives Matter movement and against police brutality and against police involvement at NU. [size=about 200]",0,1612546505
10205,12-Oct-20,2020,Protests,Peaceful protest,Protesters (United States),United States,Illinois,Cook,Evanston,42.0411,-87.6901,Daily Northwestern; Crowd Counting Consortium,"On 12 October 2020, students led by the Northwestern Community Not Cops movement began protesting in Evanston (Illinois) in support of Black Lives Matter movement after their petition with demands including the abolition of University Police to the University with over 8,000 signatures went unanswered for months. [size=no report]",0,1612546506
10252,12-Oct-20,2020,Protests,Peaceful protest,Protesters (United States),United States,Illinois,Cook,Chicago,41.85,-87.6501,Chicago Sun-Times,"On 12 October 2020, several hundred Italian Americans gathered in Arigo Park in Chicago (Illinois) to protest the removal of the Christopher Columbus statute. [size=several hundred]",0,1612546504
10538,9-Oct-20,2020,Protests,Peaceful protest,Protesters (United States),United States,Illinois,Cook,Chicago,41.85,-87.6501,CBS2 (Chicago); Crowd Counting Consortium,"On 9 October 2020, student athletes protested outside the home of Dr. Ngozi Ezike, the director of the Illinois Department of Public Health in Chicago (Illinois) to demand the return to high school sports during the ongoing coronavirus pandemic. [size=no report]",0,1612546505
10710,7-Oct-20,2020,Protests,Peaceful protest,Protesters (United States),United States,Illinois,Cook,Chicago,41.85,-87.6501,Chicago Tribune,"On 7 October 2020, 4 Purple Pig employees gathered outside of the restaurant in Chicago (Illinois) over concerns of coronavirus safety negligence. [size=4]",0,1612546503
10745,7-Oct-20,2020,Protests,Peaceful protest,Protesters (United States),United States,Illinois,Cook,Chicago,41.85,-87.6501,WBBJ ABC7,"On 7 October 2020, people staged a protest in Chicago (Illinois) in support of the Black Lives Matter movement and against violence against women. The protest was organized by an organization named 'First Ladies.' [size=no report]",0,1612915999
10831,5-Oct-20,2020,Protests,Peaceful protest,Protesters (United States),United States,Illinois,Cook,Chicago,41.85,-87.6501,Fox2 (St. Louis),"On 5 October 2020, student-athletes staged a protest in Chicago (Illinois) in support of the resumption of fall high school sports during the coronavirus pandemic. [size=no report]",0,1612546502
10999,3-Oct-20,2020,Protests,Peaceful protest,Protesters (United States),United States,Illinois,Cook,Chicago,41.85,-87.6501,CBS2 (Chicago),"On 3 October 2020, dozens of people staged a protest in Chicago (Illinois) against local evictions during the coronavirus. [size=dozens]",0,1612546502
11000,3-Oct-20,2020,Protests,Peaceful protest,Protesters (United States),United States,Illinois,Cook,Chicago,41.85,-87.6501,CBS2 (Chicago),"On 3 October 2020, people, including members of the U.S. military, staged a protest in Chicago (Illinois) in support of an end to sexual harassment and sexual assault in the military, and justice for Army Pvt. Vanessa Guillen. [size=no report]",0,1612546502
11007,3-Oct-20,2020,Protests,Peaceful protest,Protesters (United States),United States,Illinois,Cook,Evanston,42.0411,-87.6901,Chicago Sun-Times,"On 3 October 2020, hundreds of people staged a rally in Evanston (Illinois) in support of the Black Lives Matter movement and against the death of Breonna Taylor and the shooting of Jacob Blake. The rally was organized by the families of Taylor and Blake and Rev. Jesse Jackson's Rainbow PUSH Coalition. [size=hundreds]",0,1612546502
11324,1-Oct-20,2020,Protests,Peaceful protest,Protesters (United States),United States,Illinois,Cook,Chicago,41.85,-87.6501,Chicago Tribune,"On 1 October 2020, nearly 20 people staged a protest in Chicago (Illinois) against Canada Goose company's use of down and coyote fur in its coats. The protest was organized by People for the Ethical Treatment of Animals. [size=nearly 20]",0,1612546502
11361,1-Oct-20,2020,Protests,Peaceful protest,Protesters (United States),United States,California,Riverside,Riverside,33.9859,-117.3534,Highlander; Crowd Counting Consortium,"On 1 October 2020, about 30 students and faculty rallied at the University of California in Riverside (California) as part of the UC Cops Off Campus Coalition's ''state-wide day of action'' calling for police to be removed from all University of California campuses by the start of the 2021-2022 academic year. [size=about 30]",0,1612546510
11417,30-Sep-20,2020,Protests,Peaceful protest,Protesters (United States),United States,Illinois,Cook,Evanston,42.0411,-87.6901,Count Love; People's World,"On 30 September 2020, food service workers at Northwestern University staged a protest in Evanston (Illinois) in support of increased protections for food service workers working at the university during the coronavirus pandemic, and the extension of their health care coverage for workers who have been laid off. [size=no report]",0,1612546502
11733,26-Sep-20,2020,Protests,Peaceful protest,Protesters (United States),United States,Illinois,Cook,Arlington Heights,42.095,-87.9808,Daily Herald (Arlington Heights),"On 26 September 2020, about 300 people staged a protest in Arlington Heights (Illinois) in support of reopening schools for in-person instruction during the coronavirus pandemic. Students joined the protest. [size=about 300]",0,1612546501
11760,26-Sep-20,2020,Protests,Peaceful protest,Protesters (United States),United States,Illinois,Cook,Chicago,41.85,-87.6501,Chicago Sun-Times; WGN Channel 9,"On 26 September 2020, about 300 people staged a protest at Daley Plaza in Chicago (Illinois) in support of the Black Lives Matter movement and against the grand jury's decision in Breonna Taylor's case. The protest was organized by an organization called 'My Block, My Hood, My City.' [size=about 300]",0,1612915999
12275,23-Sep-20,2020,Protests,Protest with intervention,Protesters (United States),United States,Illinois,Cook,Chicago,41.85,-87.6501,WGN Channel 9; Washington Post; USA Today; New York Times; ABC7 Chicago; NBC6 Chicago,"On 23 September 2020, hundreds of people staged a protest throughout multiple neighborhoods in Chicago (Illinois) in support of the Black Lives Matter movement and against the grand jury's decision in Breonna Taylor's case. The demonstration was largely peaceful apart from some minor acts of vandalism such as graffitiing the Illinois Centennial Monument in Logan Square and a couch being lit on fire in the road briefly by one man, no violence occurred during the demonstrations. The man who set a couch on fire was arrested by police for reckless conduct and felony possession of a controlled substance. [size=hundreds]",0,1614124492
12604,20-Sep-20,2020,Protests,Peaceful protest,Protesters (United States),United States,Illinois,Cook,Chicago,41.85,-87.6501,Block Club Chicago,"On 20 September 2020, more than 200 people gathered to protest at Albany Park in Chicago (Illinois) against gun violence in their neighborhood, after seven people were shot over the course of three days in the previous week. [size=more than 200]",0,1612546500
12645,20-Sep-20,2020,Strategic developments,Other,American Contingency,United States,Illinois,Cook,Chicago,41.85,-87.6501,MilitiaWatch,"Training: On 20 September 2020, the American Contingency group held a training event for carbine use in Chicago (Illinois) to a sold-out audience.",0,1612546500
12665,19-Sep-20,2020,Protests,Peaceful protest,Protesters (United States),United States,Illinois,Cook,Chicago,41.85,-87.6501,Chicago Sun-Times; Chicago Tribune,"On 19 September 2020, about 100 students and parents staged a protest at the Thompson Center in Chicago (Illinois), in support of the resumption of high school fall sports during the coronavirus pandemic. [size=about 100]",0,1612546500
12820,18-Sep-20,2020,Strategic developments,Other,American Contingency,United States,Illinois,Cook,Chicago,41.85,-87.6501,MilitiaWatch,"Training: Around 18 September 2020 (between 18 Sept - 19 Sept), the American Contingency led at least three sold-out training seminars in Chicago (Illinois). The trainings covered pistol use and street combat.",0,1612546500
12899,17-Sep-20,2020,Protests,Peaceful protest,Protesters (United States),United States,Illinois,Cook,Chicago,41.85,-87.6501,ABC7 Chicago,"On 17 September 2020, several families protested at the office of Cook County State's Attorney Kim Foxx in Chicago (Illinois), against her handling of several recent murder cases, and her recent decision to grant early release to convicted criminals. [size=several families]",0,1612546500
12946,16-Sep-20,2020,Protests,Peaceful protest,Protesters (United States),United States,Illinois,Cook,Chicago,41.85,-87.6501,ABC7 Chicago,"On 16 September 2020, hundreds of people staged a protest in support of the 'Back the Blue' movement at Jefferson Park in Chicago (Illinois). A number of counter-protesters were present, protesting in support of the Black Lives Matter movement. [size=hundreds] [counter-protest]",0,1612916000
12973,16-Sep-20,2020,Protests,Peaceful protest,Protesters (United States),United States,Illinois,Cook,Chicago,41.85,-87.6501,ABC7 Chicago,"On 16 September 2020, people staged a protest in Chicago (Illinois) to protest against gentrification and the potential displacement of Chicago's Discount Mall, where immigrant entrepreneurs sell goods and start businesses. [size=no report]",0,1612546500
13030,15-Sep-20,2020,Protests,Peaceful protest,Protesters (United States),United States,Illinois,Cook,Chicago,41.85,-87.6501,Chicago Sun-Times,"On 15 September 2020, people marched in a protest in Chicago (Illinois) in support of immigrants and in opposition to U.S. Immigration and Customs Enforcement. The protest was organized by the Chicago Alliance Against Political Repression, the Brighton Park Neighborhood Council, and the United Workers Center. [size=no report]",0,1612546499
13283,13-Sep-20,2020,Protests,Peaceful protest,Protesters (United States),United States,Illinois,Cook,Chicago,41.85,-87.6501,CBS2 (Chicago),"On 13 September 2020, dozens of people staged a protest in Chicago (Illinois) in support of rent forgiveness during the coronavirus pandemic. The protest was organized by the North Spaulding Renters Association. [size=dozens]",0,1612546499
13410,12-Sep-20,2020,Protests,Peaceful protest,Protesters (United States),United States,Illinois,Cook,Chicago,41.85,-87.6501,Chicago Tribune; WGN Channel 9; Fox35,"On 12 September 2020, dozens of nurses picketed in front of the University of Illinois Hospital in Chicago (Illinois) while 800 nurses walked out on strike, demanding a limit to the number of patients under the care of each nurse. [size=dozens]",0,1612546499
13546,11-Sep-20,2020,Protests,Peaceful protest,Protesters (United States),United States,Illinois,Cook,Chicago,41.85,-87.6501,Chicago Sun-Times,"On 11 September 2020, about 100 people marched down Garfield Boulevard in Washington Park in Chicago (Illinois) to memorialize young Black and Brown Chicagoans who have lost their lives to violence. The 'Love March' was also held with a rally and a candlelight vigil. [size=about 100]",0,1612916000
13700,9-Sep-20,2020,Protests,Peaceful protest,Protesters (United States),United States,Illinois,Cook,Chicago,41.85,-87.6501,NBC6 Chicago,"On 9 September 2020, people gathered to protest against gun violence and for justice in the case of Dajore Wilson, who was shot and killed, in Chicago (Illinois). [size=no report]",0,1612546499
13831,7-Sep-20,2020,Protests,Peaceful protest,Protesters (United States),United States,Illinois,Cook,Chicago,41.85,-87.6501,WGN Channel 9,"On 7 September 2020, nurses gathered for a protest in support of increased personal protective equipment against the coronavirus and better pay in Chicago (Illinois). The nurses were part of a labor union. [size=no report]",0,1612546499
13832,7-Sep-20,2020,Protests,Peaceful protest,Protesters (United States),United States,Illinois,Cook,Chicago,41.85,-87.6501,Chicago Tribune; Chicago Sun-Times,"On 7 September 2020, people staged a rally in Chicago (Illinois) in support of the inclusion of African-Americans in trade unions. A US Democratic congressional representative spoke, and the event was organized by the Chicago Black Communities United organization. [size=no report]",0,1612546499
13975,6-Sep-20,2020,Protests,Peaceful protest,Protesters (United States),United States,Illinois,Cook,Arlington Heights,42.095,-87.9808,Chicago Tribune,"On 6 September 2020, about 20 people gathered for a protest, organized by high school students, in support of the Black Lives Matter movement and against police brutality in Melas Park in Arlington Heights (Illinois). [size=about 20]",0,1612546498
