data_no,event_date,year,event_type,sub_event_type,actor1,country,admin1,admin2,location,latitude,longitude,source,notes,fatalities,timestamp
14124,5-Sep-20,2020,Protests,Peaceful protest,Protesters (United States),United States,Illinois,Cook,Chicago,41.85,-87.6501,ABC7 Chicago,"On 5 September 2020, people gathered to protest against police brutality and the death of Michael Vega in Chicago (Illinois). The rally was organized by Black Lives Matter Chicago. [size=no report]",0,1612546447
14294,3-Sep-20,2020,Protests,Peaceful protest,Protesters (United States),United States,Illinois,Cook,Chicago,41.85,-87.6501,Times of Northwest Indiana,"On 3 September 2020, about two dozen members of SEIU Local 73 protested at the school board building in Chicago (Illinois) in support of getting their jobs back after being laid off due to cutbacks during the coronavirus pandemic. [size=about two dozen]",0,1612546446
14455,2-Sep-20,2020,Protests,Peaceful protest,Protesters (United States),United States,Illinois,Cook,Chicago,41.85,-87.6501,Block Club Chicago,"On 2 September 2020, more than 100 people gathered to protest against police brutality and the shooting of Miguel Vega in Chicago (Illinois). [size=more than 100]",0,1612546446
14457,2-Sep-20,2020,Protests,Peaceful protest,Protesters (United States),United States,Illinois,Cook,Chicago,41.85,-87.6501,Chicago Sun-Times,"On 2 September 2020, at least three dozen students from the University of Chicago protested at the home of the university's provost in Chicago (Illinois) in support of abolishing the University of Chicago's police department. The student groups CareNotCops and UChicago United assisted in organizing the protest. [size=at least three dozen]",0,1612546446
14521,1-Sep-20,2020,Protests,Peaceful protest,Protesters (United States),United States,California,Riverside,Riverside,33.9859,-117.3534,SaveCalifornia.com,"On 1 September 2020, an unreported number of people rallied in Riverside (California) against the coronavirus lockdown and county and state officials. [size=no report]",0,1612546446
14624,31-Aug-20,2020,Protests,Peaceful protest,Protesters (United States),United States,Illinois,Cook,Chicago,41.85,-87.6501,Columbia Chronicle,"On 31 August 2020, dozens of people protested in support of raising the minimum wage for tipped workers to $15 in Chicago (Illinois). Representatives of the American Postal Workers Union, Fight for 15, and local Democratic party representatives were in attendance. [size=dozens]",0,1612546446
14625,31-Aug-20,2020,Strategic developments,Other,Police Forces of the United States (2017-2021),United States,Illinois,Cook,Chicago,41.85,-87.6501,Block Club Chicago,"Other: On 31 August 2020, a civilian (Miguel Vega) was shot and killed by the Chicago police in Pilsen neighborhood in Chicago (Illinois), who believed they had just been shot at. Police said the shots were fired in their direction, then officers returned fire. A gun was found at the scene, but the victim's family refute the allegation that he had a gun. The incident is under investigation. This event resulted in subsequent demonstrations.",1,1612546446
14659,31-Aug-20,2020,Protests,Peaceful protest,Protesters (United States),United States,Illinois,Cook,Chicago,41.85,-87.6501,Chicago Maroon; Crowd Counting Consortium,"On 31 August 2020, students and members of the group Care Not Cops gathered for the third consecutive day outside of the home of University of Chicago's Provost in Chicago (Illinois) in support of disbanding UCPD and creating campus cultural centers and an ethnic studies department. [size=no report]",0,1612546510
14716,30-Aug-20,2020,Protests,Peaceful protest,Protesters (United States),United States,Illinois,Cook,Evanston,42.0411,-87.6901,Chicago Sun-Times,"On 30 August 2020, a large crowd gathered in Evanston (Illinois) to protest in support of the Black Lives Matter movement and against police brutality and the shooting of Jacob Blake. [size=a large crowd].",0,1612546446
14776,30-Aug-20,2020,Protests,Peaceful protest,Protesters (United States),United States,Illinois,Cook,Chicago,41.85,-87.6501,Chicago Maroon; Crowd Counting Consortium,"On 30 August 2020, students and members of the group Care Not Cops gathered for the second consecutive day outside of the home of University of Chicago's Provost in Chicago (Illinois) in support of disbanding UCPD and creating campus cultural centers and an ethnic studies department. [size=no report]",0,1612546510
14865,29-Aug-20,2020,Protests,Peaceful protest,Protesters (United States),United States,Illinois,Cook,Chicago,41.85,-87.6501,CBS2 (Chicago); Chicago Maroon; Crowd Counting Consortium,"On 29 August 2020, hundreds of people, including students, members of the group Care Not Cops gathered on the campus of the University of Chicago and outside of the house of University's Provost in Chicago (Illinois) in support of disbanding UCPD and creating campus cultural centers and an ethnic studies department. [size=hundreds]",0,1612546446
14953,28-Aug-20,2020,Protests,Peaceful protest,Protesters (United States),United States,Illinois,Cook,Chicago,41.85,-87.6501,CBS2 (Chicago),"On 28 August 2020, people gathered to protest on the Dan Ryan overpass at 76th street in Chicago (Illinois) in support of the Black Lives Matter movement and against police brutality and the shooting of Jacob Blake. [size=no report]",0,1612546445
15154,27-Aug-20,2020,Protests,Peaceful protest,Protesters (United States),United States,Illinois,Cook,Evanston,42.0411,-87.6901,Count Love; Chicago Tribune,"On 27 August 2020, several hundred people protested in support of the Black Lives Matter movement and against police brutality and the shooting of Jacob Blake in Evanston (Illinois). [size=several hundred]",0,1612546445
15218,26-Aug-20,2020,Protests,Peaceful protest,Protesters (United States),United States,Illinois,Cook,Chicago,41.85,-87.6501,Fox32,"On 26 August 2020, students organized a protest in support of the Black Lives Matter movement at Union Park in Chicago (Illinois). 200 to 300 people, including many students, attended. [size=200-300]",0,1612546445
15539,24-Aug-20,2020,Protests,Protest with intervention,Protesters (United States),United States,Illinois,Cook,Chicago,41.85,-87.6501,WGN Channel 9,"On 24 August 2020, people, including students, gathered to protest in Chicago (Illinois) against the presence of police in Chicago's public school system. Police arrested 13 people, including two minors. [size=at least 13]",0,1612546444
15540,24-Aug-20,2020,Protests,Peaceful protest,Protesters (United States),United States,Illinois,Cook,Chicago,41.85,-87.6501,Fox32,"On 24 August 2020, people gathered in Chicago (Illinois) to protest in support of the Black Lives Matter movement and defunding Chicago's police department, and against police brutality and the shooting of Jacob Blake. [size=no report]",0,1612546444
15710,22-Aug-20,2020,Protests,Peaceful protest,Protesters (United States),United States,Illinois,Cook,Oak Park,41.8861,-87.7841,Count Love; Chicago Tribune,"On 22 August 2020, about 80 people rallied outside the post office in Oak Park (Illinois) in support of the USPS and against budget cuts to the agency. [size=about 80]",0,1612546514
15768,22-Aug-20,2020,Protests,Protest with intervention,Protesters (United States),United States,Illinois,Cook,Chicago,41.85,-87.6501,NBC6 Chicago,"On 22 August 2020, people protested in Chicago (Illinois) near the home of Chicago mayor Lori Lightfoot. The police arrested six protesters and charged them with misdemeanor counts of residential picketing. Those arrested claimed affiliation with the 'Jesus Matters Movement.' [size=no report]",0,1612916000
15821,22-Aug-20,2020,Protests,Peaceful protest,Protesters (United States),United States,Illinois,Cook,Chicago,41.85,-87.6501,Journal Gazette and Times Courier,"On 22 August 2020, about 50 people gathered to protest against child sex abuse and human trafficking at a 'Save Our Children' rally in Chicago (Illinois). [size=about 50]",0,1612916000
15850,22-Aug-20,2020,Protests,Peaceful protest,Protesters (United States),United States,Illinois,Cook,Chicago,41.85,-87.6501,NBC6 Chicago,"On 22 August 2020, hundreds of people protested at Whitney Young Magnet High School in Chicago (Illinois) in support of the Black Lives Matter movement and defunding the police, and against police brutality and the death of George Floyd. Many of the protesters were students at the school. [size=hundreds]",0,1612546440
15904,22-Aug-20,2020,Protests,Peaceful protest,Protesters (United States),United States,Illinois,Cook,Chicago,41.85,-87.6501,WGN Channel 9,"On 22 August 2020, dozens of people protested in support of the USPS in Chicago (Illinois). [size=dozens]",0,1612546441
15950,22-Aug-20,2020,Protests,Peaceful protest,Protesters (United States),United States,California,Ventura,Oak Park,34.1791,-118.7628,CBS8 (San Diego),"On 22 August 2020, an unreported number of people organised by MoveOn demonstrated by the College Grove post office in Oak Park (California) in support of the USPS and against budget cuts. [size=no report]",0,1612546441
16001,22-Aug-20,2020,Protests,Peaceful protest,Protesters (United States),United States,Maryland,Harford,Riverside,39.4737,-76.2413,Count Love; Baltimore Sun,"On 22 August 2020, an unreported number of postal workers staged a 'Save the USPS' rally in Riverside (alias Belcamp) (Maryland) in support of the USPS and against budget cuts to the agency. [size=no report]",0,1612546442
16425,18-Aug-20,2020,Protests,Peaceful protest,Protesters (United States),United States,Illinois,Cook,Chicago,41.85,-87.6501,ABC7 Chicago,"On 18 August 2020, people protested against child sex abuse and human trafficking at a 'Save Our Children' rally in downtown Chicago (Illinois). [size=no report]",0,1612916000
16535,17-Aug-20,2020,Protests,Peaceful protest,Protesters (United States),United States,Michigan,Oakland,Oak Park,42.4594,-83.1827,Reuters; Crowd Counting Consortium,"On 17 August 2020, people including retired United States Postal Service workers gathered in Oak Park (Michigan) to show support for the postal service. [size=no report]",0,1613516909
16560,16-Aug-20,2020,Protests,Peaceful protest,Protesters (United States),United States,Illinois,Cook,Chicago,41.85,-87.6501,Chicago Tribune; Count Love,"On 16 August 2020, protesters assembled at the Wentworth District police station in Chicago (Illinois) to protest the arrest of fellow protesters the previous day. Protesters were affiliated with the Black Lives Matter movement. [size=no report]",0,1612546440
16628,15-Aug-20,2020,Riots,Violent demonstration,Rioters (United States),United States,Illinois,Cook,Chicago,41.85,-87.6501,WGN Channel 9; CBS2 (Chicago),"On 15 August 2020, demonstrators in Chicago (Illinois) demanded the defunding of the police and the abolishment of US Immigration and Customs Enforcement. Demonstrators and police physically clashed, leading to injuries on both sides. Police shoved demonstrators with their shields and hit them with batons, and used pepper spray. 24 people were arrested, four of them on charges of assaulting officers. According to the police, agitators hijacked the peaceful demonstration by hiding under umbrellas and changing outfits before assaulting officers. Police also said that they were assaulted with chemical spray, bottles, and skateboards. [size=no report] [suggested agents provocateurs]",0,1612546430
16672,15-Aug-20,2020,Protests,Peaceful protest,Protesters (United States),United States,Illinois,Cook,Chicago,41.85,-87.6501,Chicago Tribune,"On 15 August 2020, about 200 people demonstrated in Chicago, Illinois in support of the Black Lives Matter movement and against police brutality and the death of George Floyd. Some counter demonstrators alleged that the demonstration brought a large number of police to the South Side and disrupted the neighbourhood. [size=about 200] [counter-protest]",0,1612546429
16849,14-Aug-20,2020,Protests,Peaceful protest,Protesters (United States),United States,Illinois,Cook,Chicago,41.85,-87.6501,ABC7 Chicago,"On 14 August 2020, people demonstrated in Chicago, Illinois in support of the Black Lives Matter movement and against police brutality and demanding that the Chicago Police Department's budget be significantly cut. [size=no report]",0,1612546429
16925,13-Aug-20,2020,Protests,Peaceful protest,Protesters (United States),United States,Illinois,Cook,Chicago,41.85,-87.6501,Block Club Chicago,"On 13 August 2020, a protest was organized the Garfield Park Chamber of Commerce in Chicago, Illinois demanding that the city allow a Black-owned liquor and grocery store to reopen after it was shut down by police in July over alleged criminal activity around the business. [size=no report]",0,1612546429
16926,13-Aug-20,2020,Protests,Peaceful protest,Protesters (United States),United States,Illinois,Cook,Chicago,41.85,-87.6501,Chicago Tribune,"On 13 August 2020, over 100 students demonstrated in Chicago, Illinois demanding the removal of police from schools. [size=over 100]",0,1612546429
17073,11-Aug-20,2020,Protests,Peaceful protest,Protesters (United States),United States,Illinois,Cook,Chicago,41.85,-87.6501,ABC7 Chicago,"On 11 August 2020, Black Lives Matter supporters organized a demonstration in Chicago, Illinois at the Englewood Police Station demanding accountability and transparency over a police shooting on 7 August in Englewood. [size=no report]",0,1612546429
17074,11-Aug-20,2020,Protests,Peaceful protest,Protesters (United States),United States,Illinois,Cook,Chicago,41.85,-87.6501,Northwest Herald,"On 11 August 2020, about 110 YMCA swimmers, coaches and parents demonstrated in Chicago, Illinois against the local YMCA's decision to cut the swim team in half amid the coronavirus pandemic. [size=about 110]",0,1612546429
17083,11-Aug-20,2020,Protests,Peaceful protest,Protesters (United States),United States,Illinois,Cook,Riverside,41.8361,-87.8272,WGN Channel 9,"On 11 August 2020, teachers demonstrated in Riverside, Illinois demanding remote learning this fall amid the coronavirus pandemic. [size=no report] [schools]",0,1612546429
17112,10-Aug-20,2020,Riots,Violent demonstration,Rioters (United States),United States,Illinois,Cook,Chicago,41.85,-87.6501,NBC6 Chicago,"On 10 August 2020, in the early hours, many retailers in Chicago, Illinois were looted. Looters damaged properties and stole a great deal of merchandise. Police said over a dozen looters were already facing charges but the investigation is ongoing. Over 100 people were arrested. Police said at least 13 officers were injured during confrontations with looters from August 9 into August 10. Some suggest that the looting may have been sparked by police shooting of a Black man on 8 August. [size=over 100]",0,1612546430
17186,10-Aug-20,2020,Protests,Peaceful protest,Protesters (United States),United States,Illinois,Cook,Chicago,41.85,-87.6501,NBC6 Chicago,"On 10 August 2020, over 100 members of Black Lives Matter demonstrated in Chicago, Illinois in support of the people arrested in the early hours of August 10 over looting. [size=over 100]",0,1612546429
17211,9-Aug-20,2020,Riots,Violent demonstration,Rioters (United States),United States,Illinois,Cook,Chicago,41.85,-87.6501,NBC6 Chicago,"On 9 August 2020, many retailers in Chicago, Illinois were looted. Looters damaged properties and stole a great deal of merchandise. Police said over a dozen looters were already facing charges but the investigation is ongoing. Over 100 people were arrested. Police said at least 13 officers were injured during confrontations with looters from August 9 into August 10. Some suggest that the looting may have been sparked by police shooting of a Black man the day before. [size=at least 100]",0,1612546430
17321,8-Aug-20,2020,Protests,Peaceful protest,Protesters (United States),United States,Illinois,Cook,Chicago,41.85,-87.6501,Chicago Tribune,"On 8 August 2020, over 100 people protested in Chicago, Illinois for moms who lost their children to police brutality. They demonstrated in support of the Black Lives Matter movement and against police brutality and the death of George Floyd. [size=over 100]",0,1612546429
17454,7-Aug-20,2020,Protests,Peaceful protest,Protesters (United States),United States,Illinois,DuPage,Oakbrook Terrace,41.85,-87.9645,Daily Herald (Arlington Heights),"On 7 August 2020, a handful of people demonstrated in Oakbrook Terrace, Illinois in support of the Black Lives Matter movement and against a restaurant owner's comments about kneeling during the national anthem. [size=a handful]",0,1612546429
17470,7-Aug-20,2020,Protests,Peaceful protest,Protesters (United States),United States,New York,Onondaga,Cicero,43.1692,-76.1167,NBC3,"On 7 August 2020, people staged a protest at the Cicero police station in Cicero (New York) in support of Back the Blue movement and the local law enforcement. [size=no report]",0,1612546428
17608,6-Aug-20,2020,Protests,Peaceful protest,Protesters (United States),United States,Illinois,Cook,Chicago,41.85,-87.6501,USA Today,"On 6 August 2020, a group of 20 demonstrators stayed in Chicago (Illinois) during their 750-mile protest walk from Milwaukee to Washington DC in response the death of George Floyd and to show support for the Black Lives Matter movement and racial justice. The demonstrators planned to walk about 30 miles per day for 24 days. [size=a group of 20]",0,1614122725
17702,5-Aug-20,2020,Protests,Peaceful protest,Protesters (United States),United States,Illinois,Cook,Chicago,41.85,-87.6501,Chicago Tribune,"On 5 August 2020, nurses marched in Chicago, Illinois demanding sufficient personal protective equipment amid the coronavirus pandemic. [size=no report]",0,1612546429
17704,5-Aug-20,2020,Protests,Peaceful protest,Protesters (United States),United States,Illinois,Cook,Chicago,41.85,-87.6501,Twitter,"On 5 August 2020, hospitality workers who were laid off demonstrated in Chicago, Illinois demanding their lost health insurance coverage amid the coronavirus pandemic. [size=no report]",0,1612546429
17758,4-Aug-20,2020,Protests,Peaceful protest,Protesters (United States),United States,Illinois,Cook,Chicago,41.85,-87.6501,Chicago Tribune,"On 4 August 2020, people gathered in Chicago, Illinois to remember a Black teenager shot and died recently, and called upon the community to act to remove police from a local school, which was what the teenager was advocating for before he died. [size=no report]",0,1612546429
17762,4-Aug-20,2020,Protests,Peaceful protest,Protesters (United States),United States,Illinois,Cook,Chicago,41.85,-87.6501,CBS2 (Chicago),"On 4 August 2020, teachers held a caravan protest in Chicago, Illinois urging students to stay at home and do remote learning amid the coronavirus pandemic. [size=no report] [schools]",0,1612546429
17876,3-Aug-20,2020,Protests,Peaceful protest,Protesters (United States),United States,Illinois,Cook,Chicago,41.85,-87.6501,Chicago Tribune,"On 3 August 2020, the Chicago Teachers Union and the parents and students of Chicago Public Schools marched in Chicago, Illinois as part of the national 'day of action' demanding that schools be closed this fall amid the coronavirus pandemic. [size=no report] [schools]",0,1612916000
17978,2-Aug-20,2020,Protests,Peaceful protest,Protesters (United States),United States,Illinois,Cook,Chicago,41.85,-87.6501,ABC7 Chicago,"On 2 August 2020, dozens of people held a 'Walk To Support CPD' march in Chicago, Illinois to support the police. [size=dozens]",0,1612916000
18134,1-Aug-20,2020,Protests,Peaceful protest,Protesters (United States),United States,Illinois,Cook,Chicago,41.85,-87.6501,ABC7 Chicago; CBS2 (Chicago),"On 1 August 2020, thousands of students staged a 'Students Strike Back' protest in Chicago, Illinois. They for the removal of police from schools and universities and for universities to cut ties with the U.S. Immigration and Customs Enforcement (ICE). They also demanded more medical and mental health resources in their communities. [size=hundreds]",0,1612916001
18149,1-Aug-20,2020,Protests,Peaceful protest,Protesters (United States),United States,Illinois,Cook,Chicago,41.85,-87.6501,CBS2 (Chicago); ABC7 Chicago,"On 1 August 2020, women who are current and former military members protested in Chicago, Illinois against sexual harassment in the military, demanding justice for Vanessa Guillen, a female soldier allegedly sexually harassed, killed, and dismembered by a fellow soldier in Texas. [size=no report]",0,1612546428
18218,31-Jul-20,2020,Protests,Peaceful protest,Protesters (United States),United States,Illinois,Cook,Arlington Heights,42.095,-87.9808,Daily Herald (Arlington Heights),"On 31 July 2020, about 40 Blue Lives Matter protesters demonstrated in Arlington Heights, Illinois in support of the police and the Blue Lives Matter movement. A few counter protesters demonstrated in support of the Black Lives Matter movement and defunding the police. [size=over 40] [counter-protest]",0,1612546428
18240,31-Jul-20,2020,Protests,Peaceful protest,Protesters (United States),United States,Illinois,Cook,Evanston,42.0411,-87.6901,Chicago Sun-Times; Count Love; Chicago Tribune,"On 31 July 2020, over 300 people protested in Evanston, Illinois in support of the Black Lives Matter movement and in support of a Black woman who confronted a few White people on the beach displaying a Confederate flag two days before. [size=over 300]",0,1612546428
18270,31-Jul-20,2020,Protests,Peaceful protest,Protesters (United States),United States,Illinois,Cook,Chicago,41.85,-87.6501,Block Club Chicago,"On 31 July 2020, dozens of children, teenagers, and parents held a 'Kids Lives Matter' march in Chicago, Illinois against the gun violence that has afflicted children in Chicago. [size=dozens]",0,1612916001
18307,30-Jul-20,2020,Protests,Peaceful protest,Protesters (United States),United States,Illinois,Cook,Evanston,42.0411,-87.6901,Chicago Sun-Times; Count Love,"On 30 July 2020, dozens of people protested in Evanston, Illinois in support of the Black Lives Matter movement and a Black woman who confronted a few White people on the beach displaying a Confederate flag a day before. [size=dozens]",0,1612546428
18446,29-Jul-20,2020,Protests,Peaceful protest,Protesters (United States),United States,Illinois,Cook,Evanston,42.0411,-87.6901,Count Love; Chicago Sun-Times,"On 29 July 2020, a small group of people protested in Evanston, Illinois in support of the Black Lives Matter movement after a Black woman confronted a few White people on the beach displaying a Confederate flag. They stayed until the group left. [size=a small group]",0,1612546428
18767,26-Jul-20,2020,Protests,Peaceful protest,Protesters (United States),United States,Illinois,Cook,Chicago,41.85,-87.6501,CBS2 (Chicago),"On 26 July 2020, dozens of Italian-Americans protested in Chicago, Illinois against the mayor's decision to take down two Christopher Columbus statues. [size=dozens]",0,1612546427
18822,25-Jul-20,2020,Protests,Peaceful protest,Protesters (United States),United States,Illinois,Cook,Chicago,41.85,-87.6501,USA Today,"On 25 July 2020, dozens of people demonstrated in Chicago, Illinois at the site of the former Columbus statue in support of the Back the Blue movement and the police. Counter-demonstrators rallied in support of the Black Lives Matter movement and against police brutality and the death of George Floyd. Some members from each side pushed each other, but the protest remained peaceful otherwise. Dozens of police on bikes stood in between to deter physical altercation. Later in the day after BLM and anti-ICE (U.S. Immigration and Customs Enforcement) protesters merged in the evening, hundreds marched through downtown calling for defunding the police and against federal agents from the Department of Homeland Security to be deployed in Chicago. [size=hundreds] [counter-protest]",0,1612546427
18823,25-Jul-20,2020,Protests,Peaceful protest,Protesters (United States),United States,Illinois,Cook,Chicago,41.85,-87.6501,USA Today,"On 25 July 2020, people protested in Chicago, Illinois against the U.S. Immigration and Customs Enforcement. Later they merged with Black Lives Matter protesters. [size=no report]",0,1612546427
19000,25-Jul-20,2020,Protests,Peaceful protest,Protesters (United States),United States,Illinois,Cook,Park Ridge,42.0111,-87.8406,Chicago Tribune; Crowd Counting Consortium,"On 25 July 2020, about 30 protesters gathered on the corner of Northwest Highway and Prospect in Park Ridge (Illinois) in support of the Black Lives Matter movement and against police brutality and the death of George Floyd. [size=about 30]",0,1612546511
19003,25-Jul-20,2020,Protests,Peaceful protest,Protesters (United States),United States,Illinois,Cook,Chicago,41.85,-87.6501,Block Club Chicago,"On 25 July 2020, people protested in Chicago, Illinois in 'the Love March' against gun violence. [size=no report]",0,1612916001
19034,24-Jul-20,2020,Protests,Peaceful protest,Protesters (United States),United States,Illinois,Cook,Chicago,41.85,-87.6501,Count Love; WGN Channel 9,"On 24 July 2020, dozens of workers protested in Chicago, Illinois demanding the $600 a week additional unemployment benefits be extended amid the coronavirus pandemic. [size=dozens]",0,1612546427
19043,24-Jul-20,2020,Protests,Peaceful protest,Protesters (United States),United States,Illinois,Cook,Chicago,41.85,-87.6501,Chicago Sun-Times; Count Love,"On 24 July 2020, people protested in Chicago, Illinois against gun violence. Cook County Board President spoke at the rally. [size=no report]",0,1612546427
